[
  {
    "ticketId": "55555555-0000-0000-0000-000000000001",
    "appointmentId": "66666666-0000-0000-0000-000000000001",
    "patientId": "33333333-0000-0000-0000-000000000001",
    "doctorId": "22222222-0000-0000-0000-000000000001",
    "doctorUserId": "11111111-0000-0000-0000-000000000001",
    "departmentId": "44444444-0000-0000-0000-000000000001",
    "ticketType": "FIRST",
    "state": "WAITING",
    "version": 1
  }
]
